"É^ÉCÉgÉã(ì˙ñ{åÍ)","É^ÉCÉgÉã(âpåÍ)","íòé“(ì˙ñ{åÍ)","íòé“(âpåÍ)","éèñº(ì˙ñ{åÍ)","éèñº(âpåÍ)","ä™","çÜ","äJénÉyÅ[ÉW","èIóπÉyÅ[ÉW","èoî≈îNåé","ç∏ì«ÇÃóLñ≥","èµë“ÇÃóLñ≥","ãLèqåæåÍ","åfç⁄éÌï ","ISSN","ID:DOI","ID:JGlobalID","ID:NAID(CiNiiÇÃID)","ID:PMID","Permalink","URL","äTóv(ì˙ñ{åÍ)","äTóv(âpåÍ)"
"Quantum Ratchets","Quantum Ratchets","","","Journal of the Physical Society of Japan","Journal of the Physical Society of Japan","","","","","19970000","1","0","","0","0031-9015","10.1143/jpsj.66.4055","","","","","http://orcid.org/0000-0001-9022-358X","",""
"Density Fluctuations in Traffic Flow","Density Fluctuations in Traffic Flow","","","Journal of the Physical Society of Japan","Journal of the Physical Society of Japan","","","","","19960400","1","0","","0","0031-9015","10.1143/jpsj.65.916","","","","","http://orcid.org/0000-0001-9022-358X","",""
"Coupled-Map Modeling of One-Dimensional Traffic Flow","Coupled-Map Modeling of One-Dimensional Traffic Flow","","","Journal of the Physical Society of Japan","Journal of the Physical Society of Japan","","","","","19950100","1","0","","0","0031-9015","10.1143/jpsj.64.35","","","","","http://orcid.org/0000-0001-9022-358X","",""
"Scale-Free Features in the Observed Traffic Flow","Scale-Free Features in the Observed Traffic Flow","","","Traffic and Granular FlowÅf05","Traffic and Granular FlowÅf05","","","","","","1","0","","0","","10.1007/978-3-540-47641-2_69","","","","","http://orcid.org/0000-0001-9022-358X","",""
"Particle-Dynamics Approach to Non-Equilibrium Phenomena","Particle-Dynamics Approach to Non-Equilibrium Phenomena","Ogushi Fumiko, Watanabe Hiroshi, Yukawa Satoshi, Ito Nobuyasu","Ogushi Fumiko, Watanabe Hiroshi, Yukawa Satoshi, Ito Nobuyasu","","","","","","","","1","0","","0","","","","","","","http://orcid.org/0000-0001-9022-358X","",""
